{
  "success": true,
  "mode": "DoWhy 0.14 正式 do-calculus",
  "analysis_mode": "light",
  "concepts": [
    "用户",
    "平台",
    "内容",
    "信息茧房",
    "观点极化",
    "降低",
    "算法",
    "下降",
    "减少",
    "用户行为",
    "数据",
    "推送"
  ],
  "concept_frequencies": {
    "用户": 4,
    "平台": 4,
    "内容": 3,
    "信息茧房": 3,
    "观点极化": 3,
    "降低": 3,
    "算法": 3,
    "下降": 3,
    "减少": 3,
    "用户行为": 2,
    "数据": 2,
    "推送": 2
  },
  "ccm_eligible_concepts": [
    "用户",
    "内容",
    "信息茧房",
    "观点极化",
    "降低",
    "算法",
    "平台",
    "下降",
    "减少"
  ],
  "adjacency_matrix": [
    [
      0.0,
      6.4,
      1.6,
      0.0,
      6.4,
      4.8,
      6.4,
      6.4,
      4.8,
      0.0,
      0.0,
      0.0
    ],
    [
      6.4,
      0.0,
      3.2,
      0.0,
      0.0,
      0.0,
      0.0,
      4.8,
      4.8,
      3.2,
      3.2,
      0.0
    ],
    [
      1.6,
      0.0,
      0.0,
      3.2,
      6.4,
      0.0,
      0.0,
      3.2,
      0.0,
      0.0,
      0.0,
      1.6
    ],
    [
      6.4,
      4.8,
      0.0,
      0.0,
      6.4,
      3.2,
      4.8,
      1.6,
      1.6,
      0.0,
      0.0,
      0.0
    ],
    [
      0.0,
      6.4,
      0.0,
      0.0,
      0.0,
      6.4,
      6.4,
      0.0,
      0.0,
      0.0,
      0.0,
      0.0
    ],
    [
      0.0,
      6.4,
      3.2,
      3.2,
      0.0,
      0.0,
      4.8,
      3.2,
      3.2,
      3.2,
      1.6,
      0.0
    ],
    [
      0.0,
      8.0,
      3.2,
      0.0,
      0.0,
      0.0,
      0.0,
      3.2,
      3.2,
      3.2,
      3.2,
      0.0
    ],
    [
      0.0,
      0.0,
      3.2,
      0.0,
      3.2,
      0.0,
      0.0,
      0.0,
      8.0,
      0.0,
      0.0,
      0.0
    ],
    [
      0.0,
      0.0,
      8.0,
      0.0,
      3.2,
      0.0,
      0.0,
      0.0,
      0.0,
      0.0,
      0.0,
      0.0
    ],
    [
      4.8,
      0.0,
      1.6,
      3.2,
      0.0,
      0.0,
      0.0,
      1.6,
      1.6,
      0.0,
      3.2,
      3.2
    ],
    [
      6.4,
      0.0,
      1.6,
      3.2,
      0.0,
      1.6,
      0.0,
      1.6,
      1.6,
      0.0,
      0.0,
      3.2
    ],
    [
      4.8,
      0.0,
      1.6,
      6.4,
      4.8,
      1.6,
      1.6,
      0.0,
      0.0,
      0.0,
      0.0,
      0.0
    ]
  ],
  "treatment": "算法",
  "outcome": "平台",
  "identifiable": false,
  "identifiability": {
    "identifiable": false,
    "estimand_type": "nonparametric-ate",
    "backdoor_paths": "backdoor (simulated, synthetic)",
    "adjustment_set": []
  },
  "ate": -0.04056462709877451,
  "confidence_interval": [
    -0.14655662333988434,
    0.06542736914233531
  ],
  "confidence_method": "OLS-analytic",
  "refutations": [],
  "counterfactual_scan": [
    {
      "source": "算法",
      "target": "平台",
      "trace_dnl": 8.0,
      "ite": 0.0,
      "observed": -12794.58620666841,
      "counterfactual": -12794.58620666841
    },
    {
      "source": "下降",
      "target": "减少",
      "trace_dnl": 8.0,
      "ite": 0.0,
      "observed": -12675.017225174068,
      "counterfactual": -12675.017225174068
    },
    {
      "source": "减少",
      "target": "内容",
      "trace_dnl": 8.0,
      "ite": 0.0,
      "observed": -18833.487032097935,
      "counterfactual": -18833.487032097935
    },
    {
      "source": "用户",
      "target": "平台",
      "trace_dnl": 6.4,
      "ite": 0.0,
      "observed": -12794.58620666841,
      "counterfactual": -12794.58620666841
    },
    {
      "source": "用户",
      "target": "观点极化",
      "trace_dnl": 6.4,
      "ite": 0.0,
      "observed": -11511.588231204645,
      "counterfactual": -11511.588231204645
    }
  ],
  "n_significant_edges": 12,
  "top_edges": [
    {
      "source": "算法",
      "target": "平台",
      "strength": 8.0,
      "direction": "→"
    },
    {
      "source": "下降",
      "target": "减少",
      "strength": 8.0,
      "direction": "→"
    },
    {
      "source": "减少",
      "target": "内容",
      "strength": 8.0,
      "direction": "→"
    },
    {
      "source": "用户",
      "target": "平台",
      "strength": 6.4,
      "direction": "→"
    },
    {
      "source": "用户",
      "target": "观点极化",
      "strength": 6.4,
      "direction": "→"
    },
    {
      "source": "用户",
      "target": "算法",
      "strength": 6.4,
      "direction": "→"
    },
    {
      "source": "用户",
      "target": "下降",
      "strength": 6.4,
      "direction": "→"
    },
    {
      "source": "平台",
      "target": "用户",
      "strength": 6.4,
      "direction": "→"
    }
  ],
  "threshold": 0.5,
  "window_size": 8,
  "concept_min_freq": 1,
  "max_concepts": 12,
  "max_edges_for_dowhy": 12,
  "n_samples": 1000,
  "backend": "DoWhy",
  "simulation": false,
  "dowhy_available": true,
  "causallearn_available": true,
  "estimand_type": "nonparametric-ate",
  "data_diagnostics": {
    "raw_tokens": 210,
    "valid_concept_tokens": 131,
    "unique_tokens": 100,
    "unique_concepts": 12,
    "concept_coverage": 0.6238,
    "adj_density": 0.4653,
    "max_delta_nll": 5.0,
    "signal_type": "co_occurrence",
    "bpe_type": "unknown",
    "unk_rate": 0.0,
    "n_concepts_after_aggregate": 12,
    "n_significant_edges": 12,
    "max_edges_for_dowhy": 12,
    "filter_mode": "top_n",
    "sem_regularization": "none",
    "condition_number": 11999999991328.04,
    "max_correlation": 1.0,
    "min_eigenvalue": 0.0,
    "trace_source": "cooccurrence-web",
    "analysis_mode": "light"
  },
  "execution_profile": {
    "stages": [
      {
        "stage": "read",
        "ms": 0
      },
      {
        "stage": "tokenize",
        "ms": 554
      },
      {
        "stage": "concepts",
        "ms": 1
      },
      {
        "stage": "graph",
        "ms": 0
      },
      {
        "stage": "bridge",
        "ms": 1838
      },
      {
        "stage": "identify",
        "ms": 0
      },
      {
        "stage": "estimate",
        "ms": 6
      },
      {
        "stage": "counterfactual",
        "ms": 1
      },
      {
        "stage": "report",
        "ms": 1
      }
    ],
    "total_ms": 2409
  },
  "six_warriors": {},
  "stability_analysis": {}
}